{
  "schema_version": "refinement_preflight_input/v1",
  "issue_number": 103,
  "repo": "testowner/testrepo",
  "now": "2026-01-01T00:00:00+00:00",
  "issue": {
    "number": 103,
    "title": "Test issue with valid anchor comment",
    "body": "## Machine-Readable Contract\n\n```yaml\ncontract_schema_version: v1\nissue_kind: implementation\n```\n\n## Outcome\n\nAdd scripts/baz.py.\n\n## In Scope\n\n- scripts/baz.py\n\n## Acceptance Criteria\n\n- [ ] AC1: Script exists.\n\n## Verification Commands\n\n```bash\nuv run python3 scripts/baz.py\n```\n\n## Allowed Paths\n\n- scripts/baz.py\n",
    "labels": []
  },
  "comments": [
    {
      "id": 7777001,
      "body": "Contract review approved. status: go",
      "issue_url": "https://api.github.com/repos/testowner/testrepo/issues/103"
    }
  ],
  "anchor_comment_urls": [
    "https://github.com/testowner/testrepo/issues/103#issuecomment-7777001"
  ],
  "anchor_comments": [
    {
      "id": 7777001,
      "body": "Contract review approved. status: go",
      "issue_url": "https://api.github.com/repos/testowner/testrepo/issues/103"
    }
  ]
}
